,titulo,num_reviews,rating
0,Learn Python Programming Masterclass,74631,4.566906
1,The Python Mega Course: Build 10 Real World Applications,48420,4.599522
2,2021 Complete Python Bootcamp From Zero to Hero in Python,362704,4.5873866
3,Complete Python Developer in 2021: Zero to Mastery,27274,4.674456
4,Python for Beginners: Learn Python Programming (Python 3),15426,4.4733014
5,The Complete Python Course | Learn Python by Doing,13848,4.580782
6,100 Days of Code - The Complete Python Pro Bootcamp for 2021,28725,4.735399
7,Machine Learning A-Z™: Hands-On Python & R In Data Science,145510,4.5144744
8,The Modern Python 3 Bootcamp,22968,4.708995
9,The Python Bible™ | Everything You Need to Program in Python,33076,4.6538167
10,Python for Finance: Investment Fundamentals & Data Analytics,21608,4.537769
11,Python for beginners,17845,4.466589
12,REST APIs with Flask and Python,13263,4.5613246
13,Python and Django Full Stack Web Developer Bootcamp,38557,4.5649734
14,Python A-Z™: Python For Data Science With Real Exercises!,20370,4.561456
15,Python for Absolute Beginners,18630,4.40449
16,Data Analysis with Pandas and Python,13250,4.6586113
17,Spark and Python for Big Data with PySpark,14687,4.493827
18,The Complete Python 3 Course: Beginner to Advanced!,21747,4.0725417
19,Python for Financial Analysis and Algorithmic Trading,15443,4.5045786
20,Programming with Python : HandsOn Introduction for Beginners,10376,4.440398
21,Python Bootcamp 2021 Build 15 working Applications and Games,10063,4.2299356
22,Learning Python for Data Analysis and Visualization,16212,4.3982606
23,The Advanced Python Course: Build 10 Professional Programs,587,4.618664
24,Python for Beginners with Examples,8955,4.447859
25,The Complete Python Masterclass: Learn Python From Scratch,6136,4.489318
26,Learn to Code with Python,3273,4.718765
27,Taming Big Data with Apache Spark and Python - Hands On!,10475,4.429937
28,30 Days of Python | Unlock your Python Potential,7206,4.481543
29,Python OOP : Four Pillars of OOP in Python 3 for Beginners,7549,4.5502787
30,Python - The Practical Guide,3903,4.661059
31,Data Science: Deep Learning and Neural Networks in Python,7315,4.608335
32,Python Complete Masterclass for Beginners,2431,4.5007005
33,Algorithmic Trading & Quantitative Analysis Using Python,2292,4.4121165
34,Python Programming Bootcamp,1398,4.6123
35,Python Coding MADE EASY : A Python Coding Course in Python 3,3669,4.6875257
36,Python Network Programming for Network Engineers (Python 3),6101,4.6717834
37,Python and Flask Bootcamp: Create Websites using Flask!,5823,4.61618
38,"Algorithmic Trading: Backtest, Optimize & Automate in Python",1748,4.499695
39,Python for Computer Vision with OpenCV and Deep Learning,6184,4.5618696
40,Design Patterns in Python,1318,4.4780817
41,Learn to Code with Python 3!,3616,4.0697174
42,Learn Python: Python for Beginners,2569,4.25746
43,Python Programming for Beginners in Data Science,2807,4.277259
44,Python A-Z: Learn Python Programming By Building 10 Projects,536,4.397341
45,PYTHON - A to Z Full Course for Beginners,1249,4.4484496
46,Python Programming,39,4.6398787
47,Python for Programmers,1741,4.3713613
48,Python 3 from Beginner to Expert - Learn Python from Scratch,160,4.387639
49,Learn Python: The Complete Python Programming Course,1690,4.137786
50,The Complete Python 3 Masterclass - From Beginner To Pro,690,4.6874504
51,Complete Python Scripting for Automation,1253,4.4870358
52,Learn Advanced Python Programming,48,4.5020604
53,Python for Absolute Beginners: Learn Python in a Week!,857,4.806935
54,Python: Learn Python with Real Python Hands-On Examples,90,4.4562035
55,Python Complete Course For Python Beginners,1120,3.9989476
56,Python 3 Master Course for 2021,1114,4.0761857
57,Python Tkinter Masterclass - Learn Python GUI Programming,520,4.3311167
58,Data Structures and Algorithms In Python,514,4.247576
59,Python for Beginners: Learn Python Programming (in Python 3),916,4.111509
